"APPLICATION #",FORM_NUMBER,FILE_DATE,STATUS_DATE,STATUS,STATUS_CODE,EXPIRATION_DATE,"ESTIMATED COST","REVISED COST","EXISTING USE","EXISTING UNITS","PROPOSED USE","PROPOSED UNITS",BLOCK,LOT,STREET_NUMBER,STREET_NUMBER_SFX,AVS_STREET_NAME,AVS_STREET_SFX,UNIT,UNIT_SFX,FIRST_NAME,LAST_NAME,CONTRACTORPHONE,COMPANY_NAME,STREET,STREET_SUFFIX,CITY,STATE,ZIP_CODE,CONTACT_NAME,CONTACT_PHONE,DESCRIPTION,
#200508120161,8,2005/08/12,2005/08/12,ISSUED,9,2006/02/12,6800,6800,"1 FAMILY DWELLING",,"1 FAMILY DWELLING",,1934,023A,1688,,10TH,AV,,,YONG,KIM,4156212727,"ASAP ROOFING",CLEMENT,ST,"SAN FRANCISCO",CA,94121-0000,,,RE-ROOFING.,
#200508120163,8,2005/08/12,2005/08/12,ISSUED,9,2006/08/12,30000,30000,APARTMENTS,6,APARTMENTS,6,3568,18,169,,ALBION,ST,,,UNDECIDED,UNDECIDED,,UNDECIDED,UNDECIDED,,UNDECIDED,CA,00000-0000,,,"REMODELING OF KITCHEN & 2 BATHROOMS REPLACEMENT OF SHEETROCK & FURANCE PLUS  PAINT.FLOURESCENT LIGHT",
#200508120164,8,2005/08/12,2005/08/12,ISSUED,9,2006/02/12,15000,15000,APARTMENTS,3,APARTMENTS,3,1209,11,1730,,FELL,ST,,,"ANTHONY GERALD",LYNCH,4155665001,"ANTHONY LYNCH",FREDERICK,ST,"SAN FRANCISCO",CA,94117-0000,,,"INSTALL NEW KITCHEN CABINETS  NEW SHEETROCK ON WALLS. INSTALL NEW BATH & TOILET & VANITY & FAN.",
#200508120165,8,2005/08/12,2005/08/12,ISSUED,9,2006/02/12,10000,10000,"PRINTING PLANT",6,"PRINTING PLANT",6,3594,40,568,A,SHOTWELL,ST,,,,,,,,,,,,,,"new cabinets in kitchen   provide florescant light new tile in bathrm on wall only. kitchen",
#200508120166,8,2005/08/12,2005/08/12,ISSUED,9,2005/12/12,3600,3600,APARTMENTS,7,APARTMENTS,7,87,18,459,,GREENWICH,ST,,,UNDECIDED,UNDECIDED,,UNDECIDED,UNDECIDED,,UNDECIDED,CA,00000-0000,,,"REPLACE A TOTAL OF SIX WINDOWS DDUE TO DRY ROT",
#200508120166,8,2005/08/12,2005/08/12,ISSUED,9,2005/12/12,3600,3600,APARTMENTS,7,APARTMENTS,7,87,18,463,,GREENWICH,ST,,,UNDECIDED,UNDECIDED,,UNDECIDED,UNDECIDED,,UNDECIDED,CA,00000-0000,,,"REPLACE A TOTAL OF SIX WINDOWS DDUE TO DRY ROT",
#200508120167,8,2005/08/12,2005/08/12,ISSUED,9,2005/12/12,4000,4000,APARTMENTS,1,APARTMENTS,1,6238,15,162,,RAYMOND,AV,,,"RUSSELL LATTA",,4155660641,"LATTA CONSTRUCTION",ULLOA,ST,"SAN F RANCISCO",CA,94127-0000,,,"REMOVE LATHE & P LASTER IN ENTRY WAY (NO CHANGES NO STRUCTURAL) 5/8 TYPE 'X' GYP ON PROPERTY LINE.",
#200508120168,8,2005/08/12,2005/08/12,ISSUED,9,2005/12/12,1200,1200,"1 FAMILY DWELLING",1,"1 FAMILY DWELLING",1,3111,9,101,,HAZELWOOD,AV,,,OBR,OBR,,OBR,OBR,,OBR,CA,00000-0000,,,"BREAK 12 FT SUTCCO AND REPLACE DRYROT MEMBERS AT FACIA OF FRONT PORCH. WORK AT FRONT. WORK IN KIND",
#200508120169,8,2005/08/12,2005/08/12,ISSUED,9,2006/02/12,12000,12000,"1 FAMILY DWELLING",1,"1 FAMILY DWELLING",1,567,23,1917,,VALLEJO,ST,,,UNDECIDED,UNDECIDED,,UNDECIDED,UNDECIDED,,UNDECIDED,CA,00000-0000,,,"REV.APPL#200501062686 SCOPE OF REV.IS TO INSTALL NEW STEEL MOMENT FRAME IN DINING NOOK @1/F OWING TO",
#200508120171,8,2005/08/12,2005/08/12,ISSUED,9,2005/12/12,1,1,"1 FAMILY DWELLING",1,"1 FAMILY DWELLING",1,6639,26,1681,,NOE,ST,,,YONG,KIM,4156212727,"ASAP ROOFING",CLEMENT,ST,"SAN FRANCISCO",CA,94121-0000,,,"RENEW 200405032801 FOR FINAL INSPECTION  REROOFING",
#200508120172,8,2005/08/12,2005/08/12,ISSUED,9,2005/12/12,4500,4500,OFFICE,0,OFFICE,0,258,32,601,,CALIFORNIA,ST,0,,"SIMPLEX GRINNELL",,9252730100,"SIMPLEX GRINNELL",PRESTON,AV,LIVERMORE,CA,94550-0000,,,"T.I TO 7TH/FL ADDITION OF  2 STROBES AND ONE SPEAKER RELOCATION OF 1 SPEAKER. REF#200507258505 .",
#200508120173,8,2005/08/12,2005/08/12,ISSUED,9,2006/08/12,108203,108203,OFFICE,0,OFFICE,0,56,6,55,,FRANCISCO,ST,,,UNDECIDED,UNDECIDED,,UNDECIDED,UNDECIDED,,UNDECIDED,CA,00000-0000,,,"OTI-1   2ND FLOOR  EL  ME  LS  SP",
#200508120174,8,2005/08/12,2005/08/12,ISSUED,9,2006/08/12,40000,40000,OFFICE,0,OFFICE,0,235,22,50,,CALIFORNIA,ST,,,WILLIAM,PEACOCK,4152175095,"PEACOCK CONSTRUCTION INC","PO BOX 1818",*,LAFAYETETTE,CA,94549,,,"DEMO OF INTERIOR NON-STRUCTURAL WALALS AND CARPET  CEILING TILE  PART OF OTI TO BE SUBMITTED",
#200508120175,8,2005/08/12,2005/08/12,ISSUED,9,2005/12/12,1,1,"1 FAMILY DWELLING",1,"1 FAMILY DWELLING",1,6302,020A,193,,SCHWERIN,ST,,,"OLANDO MEDINA",,3833270006,"MORGAN CONSTRUCTION CO","W. 85TH STREET",,"LOS ANGELES",CA,90047-0000,,,"REVISION TO 200410287992. DELETE ELECTRICAL WORK",
#200508120176,8,2005/08/12,2005/08/12,ISSUED,9,2005/12/12,1,1,"TOURIST HOTEL/MOTEL",362,"TOURIST HOTEL/MOTEL",362,3722,82,125,,03RD,ST,,,ANDY,SHREK,4157732370,"WEBCOR CONSTRUCTION INC.","MARINERS ISLAND",BL,"SAN MATEO",CA,94404-0000,,,"RENEW EXPIRED PERMIT PA# 2001/10/17/1094 & PA# 2002/01/17/7180. PARTIAL PERMITS TO ALLOW",
#200508120177,8,2005/08/12,2005/08/12,ISSUED,9,2005/12/12,1,1,SCHOOL,0,SCHOOL,0,833,3,150,,OAK,ST,,,"SIMPLEX GRINNELL",,9252730100,"SIMPLEX GRINNELL",PRESTON,AV,LIVERMORE,CA,94550-0000,,,"REVISED AS BUILTS. CORRECTED SEQ OF OPS. TO REFLECT ALARM CONDITION FOR DUCT DETECTORS. ALL CHANGES",
#200508120178,8,2005/08/12,2005/08/12,ISSUED,9,2006/08/12,75000,75000,OFFICE,0,OFFICE,0,3721,72,101,,02ND,ST,,,UNDECIDED,UNDECIDED,,UNDECIDED,UNDECIDED,,UNDECIDED,CA,00000-0000,,,"OTI-1   FLOOR 12  EL  ME  LS  SP",
#200508120179,8,2005/08/12,2005/08/12,ISSUED,9,2005/12/12,100,100,"1 FAMILY DWELLING",1,"1 FAMILY DWELLING",1,2462A,16,2670,,35TH,AV,,,UNDECIDED,UNDECIDED,,UNDECIDED,UNDECIDED,,UNDECIDED,CA,00000-0000,,,"REVISION TO APPL#200407300284 RECONFIGURE FLOOR PLAN LAYOUT PER PLAN.REVISION ARE INDICATED BY 1 ON",
#200508120180,8,2005/08/12,2005/08/12,ISSUED,9,2005/12/12,5000,5000,APARTMENTS,6,APARTMENTS,6,1188,002C,57,,ASHBURY,ST,,,FLOYD,PORTEOUS,,"FLOYD PORTEOUS CONSTRUCTION",LAUREL,AV,NOVATO,CA,94945-0000,,,"REMOVE ALL OLD PARTS ( IE BATHTUBS TOILET  VANITY SINK TILE  FLOOR) PUT NEW BATH TOILET  VANITY SINK",
#200508120181,8,2005/08/12,2005/08/12,ISSUED,9,2006/08/12,40000,40000,"1 FAMILY DWELLING",1,"1 FAMILY DWELLING",1,864,15,66,,CARMELITA,ST,,,"SIMON   H  G",SPARK,4155030055,"SPARK CONSTRUCTION",LILY,ST,"SAN FRANCISCO",CA,94102-0000,,,"2 SURFACE REMODEL OF (E)BATHROOMS FIXTURE LOCATION WILL NOT CHANGE.(N)SINK (N)TOILET (N)TUB (N)SHOWE",
#200508120182,8,2005/08/12,2005/08/12,ISSUED,9,2006/02/12,12500,12500,"2 FAMILY DWELLING",2,"2 FAMILY DWELLING",2,2612,036A,117,,"BUENA VISTA",TR,,,RUAN,NEVIN,4152185631,"NEVIN RUAN",27TH,AV,"SAN FRANCISCO",CA,94117-0000,,,"REPLACE DECK BOARD FOR BOTH DECKS AT REAR 5X25. REPLACE 2 KITCHEN CABINETS AND COUNTERTOP",
#200508120182,8,2005/08/12,2005/08/12,ISSUED,9,2006/02/12,12500,12500,"2 FAMILY DWELLING",2,"2 FAMILY DWELLING",2,2612,036A,119,,"BUENA VISTA",TR,,,RUAN,NEVIN,4152185631,"NEVIN RUAN",27TH,AV,"SAN FRANCISCO",CA,94117-0000,,,"REPLACE DECK BOARD FOR BOTH DECKS AT REAR 5X25. REPLACE 2 KITCHEN CABINETS AND COUNTERTOP",
#200508120184,8,2005/08/12,2005/08/12,ISSUED,9,2005/12/12,1,1,"1 FAMILY DWELLING",1,"1 FAMILY DWELLING",1,2123B,001G,20,,CRAGMONT,AV,,,UNDECIDED,UNDECIDED,,UNDECIDED,UNDECIDED,,UNDECIDED,CA,00000-0000,,,"REVISION TO PA 200506034113 TO MOVE LOCATION OF PIERS DUE TO EXISTING TREE.  NO OTHER WORK.",
#200508120185,8,2005/08/12,2005/08/12,ISSUED,9,2005/12/12,1,1,"1 FAMILY DWELLING",1,"1 FAMILY DWELLING",1,2526A,5,45,,GOLETA,AV,,,UNDECIDED,UNDECIDED,,UNDECIDED,UNDECIDED,,UNDECIDED,CA,00000-0000,,,"REVISE POST SUPPORT FOR ARCH. PREVIOUS PA# 2005/06/24/6038.",
#200508120186,8,2005/08/12,2005/08/12,ISSUED,9,2005/12/12,3700,3700,"2 FAMILY DWELLING",,"2 FAMILY DWELLING",,1555,50,2125,,ANZA,ST,,,"UN NYUM IN",,6478484,"WEST COAST ROOFING COMPANY",19TH,AV,"SAN FRANCISCO",CA,94121,,,REROOFING,
#200508120187,8,2005/08/12,2005/08/12,ISSUED,9,2005/12/12,3000,3000,"2 FAMILY DWELLING",2,"2 FAMILY DWELLING",2,1612,21,722,,33RD,AV,,,UNDECIDED,UNDECIDED,,UNDECIDED,UNDECIDED,,UNDECIDED,CA,00000-0000,,,"REPLACE 7 WINDOWS ON FRONT OF HOUSE WITH ENERGY EFFICIENT GLASS UTILIZING (E)OPENINGS & DIMENTIONS.",
#200508120188,8,2005/08/12,2005/08/12,ISSUED,9,2005/12/12,5000,5000,"1 FAMILY DWELLING",1,"1 FAMILY DWELLING",1,4038,22,333,,TEXAS,ST,,,UNDECIDED,UNDECIDED,,UNDECIDED,UNDECIDED,,UNDECIDED,CA,00000-0000,,,"LEGALIZATION OF BACK DECK BUILT WITHOUT BENEFIT OF PERMIT.",
#200508120190,8,2005/08/12,2005/08/12,ISSUED,9,2005/12/12,1,1,"2 FAMILY DWELLING",2,"2 FAMILY DWELLING",2,2618,1,355,,ROOSEVELT,WY,,,UNDECIDED,UNDECIDED,,UNDECIDED,UNDECIDED,,UNDECIDED,CA,00000-0000,,,"REV.APPL#200506134912 RELOCATE PROPOSED BATHROOM SWAP OUT LOCATION FROM PREVIOUS PROPOSED STORAGE",
#200508120191,8,2005/08/12,2005/08/12,ISSUED,9,2005/12/12,2000,2000,OFFICE,0,OFFICE,0,4014,2,2500,,18TH,ST,,,"RICHARD E CODY",,6502220006,"CODY BROCK BUILDERS",CENTER,ST,"SAN CARLOS",CA,94070,,,"REVISION TO PA# 2005/06/13/4960. NEW INTERIOR WALLS AT ENTRY  VESTIBULE ON 1ST FLOOR. NEW DOORS.",
#200508120194,8,2005/08/12,2005/08/12,ISSUED,9,2006/02/12,20000,20000,"2 FAMILY DWELLING",2,"2 FAMILY DWELLING",2,1241,10,15,,"BUENA VISTA EAST",AV,,,UNDECIDED,UNDECIDED,,UNDECIDED,UNDECIDED,,UNDECIDED,CA,00000-0000,,,"DEMO CABINETRY/REMOVE APPL CLOSETS IN BEDRM1 PORTION OF WALL BETWEEN KITCHEN & DINING RM.INSTALL....",
#200508120197,8,2005/08/12,2005/08/12,ISSUED,9,2006/02/12,15000,15000,"1 FAMILY DWELLING",1,"1 FAMILY DWELLING",1,1069,18,184,,COLLINS,ST,,,"JIM TEEVAN",,4154748826,"TEEVAN COMPANY",WASHINGTON,ST,"SAN FRANCISCO",CA,94109,,,"REMODELING ONE BATHRM AT SECONDFL  REPACE TUB AND RELOCATE SINK  BULT A SMALL COLOSET AND INSTALL",
#200508120198,8,2005/08/12,2005/08/12,ISSUED,9,2006/02/12,12000,12000,"1 FAMILY DWELLING",1,"1 FAMILY DWELLING",1,6611,7,2112,,CASTRO,ST,,,,,,,,,,,,,,"CONSTRUCT IN STALL BARTHROOM @ GARAGE LEVEL WORK SHOP.",
#200508120199,8,2005/08/12,2005/08/12,ISSUED,9,2005/12/12,1,1,APARTMENTS,12,APARTMENTS,12,2650,44,2775,,MARKET,ST,0,,OBR,OBR,,OBR,OBR,,OBR,CA,00000-0000,,,"RENEWAL OF BLDNG APPS 200107163722-200102061504-9914318 FOR FINAL INSPECTION ONLY",
#200508120200,8,2005/08/12,2005/08/12,ISSUED,9,2005/12/12,1,1,APARTMENTS,12,APARTMENTS,12,2650,44,2775,,MARKET,ST,0,,OBR,OBR,,OBR,OBR,,OBR,CA,00000-0000,,,"FOR FINAL INSPECTION ONLY 200306247766-200209186748-200207317741-20021177250",
#200508120201,8,2005/08/12,2005/08/12,ISSUED,9,2005/12/12,1000,1000,"1 FAMILY DWELLING",1,"1 FAMILY DWELLING",1,5325,15,1588,,QUESADA,AV,,,OBR,OBR,,OBR,OBR,,OBR,CA,00000-0000,,,"PAINTING HOUSE  MINOR STUCCO REPAIR IN FRONT PAINTING WHOLE HOUSE  NEED SCAFFOLD",
#200508120203,8,2005/08/12,2005/08/12,ISSUED,9,2006/02/12,10000,10000,"1 FAMILY DWELLING",1,"1 FAMILY DWELLING",1,998,41,3248,,CLAY,ST,,,,,,,,,,,,,,"REPLACE WOOD RETAINING WALLS LOCATED IN REAR YARD WITH CONCRETE RETAINING WALL. RETAINED HEIGHT OF S",
#200508120204,8,2005/08/12,2005/08/12,ISSUED,9,2005/12/12,5000,5000,APARTMENTS,4,APARTMENTS,4,1745,1,1201,,05TH,AV,0,,"DAVID LYON",,5081970,"LYON VENTURES INC","809 EAST 5TH AVENUE",*,"SAN MATEO",CA,94402,,,"CORRECT NOV 200561697 DATED AUG 10-05  TO REPAIR REAR STAIRS",
#200508120205,8,2005/08/12,2005/08/12,ISSUED,9,2006/02/12,7000,7000,"1 FAMILY DWELLING",1,"1 FAMILY DWELLING",1,6054,33,505,,HAMILTON,ST,,,OBR,OBR,,OBR,OBR,,OBR,CA,00000-0000,,,"CONSTRUCT REAR DECK AND STAIR TO REAR YARD AND NEW PATIO DOOR PER NOV 200562325. NEW STORAGE AND",
#200508120206,8,2005/08/12,2005/08/12,ISSUED,9,2006/02/12,25000,25000,"1 FAMILY DWELLING",1,"1 FAMILY DWELLING",1,2769,18,3978,,22ND,ST,,,MINDA,LEE,4153787685,"PRESERVATION DETAILING INC.",DOUGLASS,ST,"SAN FRANCISCO",CA,94114-0000,,,"REMODEL BATHROOM - REPLACE ALL FIXTURES AND NEW SHEETROCK  TILE AND PAINT",
#200508120207,8,2005/08/12,2005/08/12,ISSUED,9,2005/12/12,1,1,OFFICE,0,OFFICE,0,3769,002A,1,,HARRISON,ST,,,"WALLACE BALDWIN   MIKE FISHER",,4154956000,"CITY BUILDING INC.","PIER 26 ANNEX",*,"SAN FRANCISCO",CA,94105,,,"ADDENDUM TO PERMIT #200410136681 CONTRACTOR HAS CHOSEN ALTERNATE ROUTING FOR  CONDUITS NO ADJUSTMENT",
#200508120208,8,2005/08/12,2005/08/12,ISSUED,9,2006/08/12,300000,300000,LIBRARY,0,LIBRARY,0,1145,3,2495,,"GOLDEN GATE",AV,,,UNDECIDED,UNDECIDED,,UNDECIDED,UNDECIDED,,UNDECIDED,CA,00000-0000,,,"NEW ROOFTOP SOLAR PANELS. NOT VISIBLE FROM GROUND. NO OTHER WORK OR CONSTRUCTION.",
#200508120209,8,2005/08/12,2005/08/12,ISSUED,9,2006/02/12,7000,7000,"1 FAMILY DWELLING",2,"1 FAMILY DWELLING",2,1261,2,757,,COLE,ST,,,,,,,,,,,,,,"INSTALL VINLY SIDING  20 SF TO REAR OF BLDG.",
#200508120210,8,2005/08/12,2005/08/12,ISSUED,9,2005/12/12,1200,1200,"1 FAMILY DWELLING",1,"1 FAMILY DWELLING",1,1936,36,1606,,08TH,AV,,,"JOSEPH & STEVE",FANFA,9253710496,"TRI VALLEY DOOR SYSTEMS INC","02ND ST",,LIVERMORE,CA,94550-0000,,,"NEW GARAGE DOOR (REPLACE EXISTING) SAME SIZE",
#200508120211,8,2005/08/12,2005/08/12,ISSUED,9,2006/08/12,30000,30000,APARTMENTS,5,APARTMENTS,5,566,43,2030,,BROADWAY,*,1,,"SEAN K.","O BRIEN",4153173734,"O BRIEN CONSTRUCTION",BELLEVUE,AV,"DALY CITY",CA,94014-0000,,,"CHANGING WINDOW & DOOR IN FRONT OF BUILDING. 3 DOORS  9 WINDOWS. ADDING NEW LIGHT FIXTURE INSIDE OF",
#200508120211,8,2005/08/12,2005/08/12,ISSUED,9,2006/08/12,30000,30000,APARTMENTS,5,APARTMENTS,5,566,44,2030,,BROADWAY,*,2,,"SEAN K.","O BRIEN",4153173734,"O BRIEN CONSTRUCTION",BELLEVUE,AV,"DALY CITY",CA,94014-0000,,,"CHANGING WINDOW & DOOR IN FRONT OF BUILDING. 3 DOORS  9 WINDOWS. ADDING NEW LIGHT FIXTURE INSIDE OF",
#200508120211,8,2005/08/12,2005/08/12,ISSUED,9,2006/08/12,30000,30000,APARTMENTS,5,APARTMENTS,5,566,45,2030,,BROADWAY,*,3,,"SEAN K.","O BRIEN",4153173734,"O BRIEN CONSTRUCTION",BELLEVUE,AV,"DALY CITY",CA,94014-0000,,,"CHANGING WINDOW & DOOR IN FRONT OF BUILDING. 3 DOORS  9 WINDOWS. ADDING NEW LIGHT FIXTURE INSIDE OF",
#200508120211,8,2005/08/12,2005/08/12,ISSUED,9,2006/08/12,30000,30000,APARTMENTS,5,APARTMENTS,5,566,47,2030,,BROADWAY,*,5,,"SEAN K.","O BRIEN",4153173734,"O BRIEN CONSTRUCTION",BELLEVUE,AV,"DALY CITY",CA,94014-0000,,,"CHANGING WINDOW & DOOR IN FRONT OF BUILDING. 3 DOORS  9 WINDOWS. ADDING NEW LIGHT FIXTURE INSIDE OF",
#200508120211,8,2005/08/12,2005/08/12,ISSUED,9,2006/08/12,30000,30000,APARTMENTS,5,APARTMENTS,5,566,46,2030,,BROADWAY,*,4,,"SEAN K.","O BRIEN",4153173734,"O BRIEN CONSTRUCTION",BELLEVUE,AV,"DALY CITY",CA,94014-0000,,,"CHANGING WINDOW & DOOR IN FRONT OF BUILDING. 3 DOORS  9 WINDOWS. ADDING NEW LIGHT FIXTURE INSIDE OF",
#200508120212,8,2005/08/12,2005/08/12,ISSUED,9,2006/08/12,125000,125000,APARTMENTS,2,APARTMENTS,2,1149,3,919,,CENTRAL,AV,,,,,,,,,,,,,,"EMODEL EXISTING GWO FAMILY RESIDENCE INCLUDING RELOCATIOS EXISTING BATHRM IN EACH UNIT. UPGRADE",
#200508120213,8,2005/08/12,2005/08/12,ISSUED,9,2005/12/12,1400,1400,APARTMENTS,4,APARTMENTS,4,868,35,331,,WALLER,ST,,,"RONNY EUGENE GIL",,6509927800,"GIL CONSTRUCTION & ASSOC  INC",MISSION,ST,"DALY CITY",CA,94015-0000,,,"TEMP REPAIRS TO REAR STAIS IN REAR BUILDING ON SAME BLCK & LOT NOV'S + ABATEMENT ARE ON FRONT BLDG",
#200508120213,8,2005/08/12,2005/08/12,ISSUED,9,2005/12/12,1400,1400,APARTMENTS,4,APARTMENTS,4,868,35,329,,WALLER,ST,,,"RONNY EUGENE GIL",,6509927800,"GIL CONSTRUCTION & ASSOC  INC",MISSION,ST,"DALY CITY",CA,94015-0000,,,"TEMP REPAIRS TO REAR STAIS IN REAR BUILDING ON SAME BLCK & LOT NOV'S + ABATEMENT ARE ON FRONT BLDG",
#200508120213,8,2005/08/12,2005/08/12,ISSUED,9,2005/12/12,1400,1400,APARTMENTS,4,APARTMENTS,4,868,35,30,,GERMANIA,ST,,,"RONNY EUGENE GIL",,6509927800,"GIL CONSTRUCTION & ASSOC  INC",MISSION,ST,"DALY CITY",CA,94015-0000,,,"TEMP REPAIRS TO REAR STAIS IN REAR BUILDING ON SAME BLCK & LOT NOV'S + ABATEMENT ARE ON FRONT BLDG",
#200508120213,8,2005/08/12,2005/08/12,ISSUED,9,2005/12/12,1400,1400,APARTMENTS,4,APARTMENTS,4,868,35,32,,GERMANIA,ST,,,"RONNY EUGENE GIL",,6509927800,"GIL CONSTRUCTION & ASSOC  INC",MISSION,ST,"DALY CITY",CA,94015-0000,,,"TEMP REPAIRS TO REAR STAIS IN REAR BUILDING ON SAME BLCK & LOT NOV'S + ABATEMENT ARE ON FRONT BLDG",
#200508120214,8,2005/08/12,2005/08/12,ISSUED,9,2006/08/12,75000,75000,"2 FAMILY DWELLING",2,"2 FAMILY DWELLING",2,1689,26,7032,,FULTON,ST,,,"VINCE  RINALDI",,4155664901,"RINALDI CONSTRUCTION",11TH,AV,"SAN FRANCISCO",CA,94116,,,"KITCHEN/BATHROOM REMODEL MAIN LEVEL-CONSTRUCT NEW MASTER BEDRM&BATHRM AT GARAGE LEVEL.W/SPRIAL......",
#200508120215,3,2005/08/12,2005/08/22,ISSUED,9,2005/12/22,1300,1300,APARTMENTS,5,APARTMENTS,5,846,15,758,,HAIGHT,ST,0,,UNDECIDED,UNDECIDED,,UNDECIDED,UNDECIDED,,UNDECIDED,CA,00000-0000,,,"REMOVE GATE AT FRONT OF PROPERTY & REPLACE WITH NEW GATE",
#200508120216,8,2005/08/12,2005/08/12,ISSUED,9,2006/08/12,250000,250000,OFFICE,0,OFFICE,0,1145,1,2130,,FULTON,ST,,,UNDECIDED,UNDECIDED,,UNDECIDED,UNDECIDED,,UNDECIDED,CA,00000-0000,,,"RENOVATION OF (E) OFFICE AREA INCLUDING REMOVAL OF (E) PARTITION & CONSTRUCTION OF NEW NON-STRUCTURA",
#200508120217,8,2005/08/12,2005/08/12,ISSUED,9,2006/02/12,7500,7500,"2 FAMILY DWELLING",2,"2 FAMILY DWELLING",2,2831,2,1218,,CASTRO,ST,,,"LYNN ODVODY",,4156417600,"LYNN D ODVODY",23RD,ST,"SAN FRANCISCO",CA,94114-0000,,,"REPLACE (E) CONCRETE SLAB AT GARAGE LELVEL WITH NEW CONCRETE SLAB ONLY",
#200508120217,8,2005/08/12,2005/08/12,ISSUED,9,2006/02/12,7500,7500,"2 FAMILY DWELLING",2,"2 FAMILY DWELLING",2,2831,2,1220,,CASTRO,ST,,,"LYNN ODVODY",,4156417600,"LYNN D ODVODY",23RD,ST,"SAN FRANCISCO",CA,94114-0000,,,"REPLACE (E) CONCRETE SLAB AT GARAGE LELVEL WITH NEW CONCRETE SLAB ONLY",
#200508120218,8,2005/08/12,2005/08/12,ISSUED,9,2006/02/12,12000,12000,"2 FAMILY DWELLING",2,"2 FAMILY DWELLING",2,2610,16,25,,DIVISADERO,ST,,,UNDECIDED,UNDECIDED,,UNDECIDED,UNDECIDED,,UNDECIDED,CA,00000-0000,,,"KITCHEN REMODEL  NEW CABINETS COUNTER  SINK  FAUCET DISHWASHER HOOD.EXST BATH:TOILET  LINEN CABINET.",
#200508120218,8,2005/08/12,2005/08/12,ISSUED,9,2006/02/12,12000,12000,"2 FAMILY DWELLING",2,"2 FAMILY DWELLING",2,2610,16,27,,DIVISADERO,ST,,,UNDECIDED,UNDECIDED,,UNDECIDED,UNDECIDED,,UNDECIDED,CA,00000-0000,,,"KITCHEN REMODEL  NEW CABINETS COUNTER  SINK  FAUCET DISHWASHER HOOD.EXST BATH:TOILET  LINEN CABINET.",
#200508120220,8,2005/08/12,2005/08/12,ISSUED,9,2005/12/12,2000,2000,"2 FAMILY DWELLING",2,"2 FAMILY DWELLING",2,2610,16,25,,DIVISADERO,ST,,,UNDECIDED,UNDECIDED,,UNDECIDED,UNDECIDED,,UNDECIDED,CA,00000-0000,,," RENEW 200301316464",
#200508120220,8,2005/08/12,2005/08/12,ISSUED,9,2005/12/12,2000,2000,"2 FAMILY DWELLING",2,"2 FAMILY DWELLING",2,2610,16,27,,DIVISADERO,ST,,,UNDECIDED,UNDECIDED,,UNDECIDED,UNDECIDED,,UNDECIDED,CA,00000-0000,,," RENEW 200301316464",
#200508120222,8,2005/08/12,2005/08/12,ISSUED,9,2005/12/12,5000,5000,"1 FAMILY DWELLING",,"1 FAMILY DWELLING",,6090,22,565,,NAPLES,ST,,,MIKE,LUONG,4152153029,"NEW PACIFIC ROOFING COMPANY INC",22ND,AV,"SAN FRANCISCO",CA,94122-0000,,,RE-ROOFING.,
#200508120223,8,2005/08/12,2005/08/12,ISSUED,9,2005/12/12,1000,1000,"1 FAMILY DWELLING",1,"1 FAMILY DWELLING",1,2334A,35,2228,,16TH,AV,,,OBR,OBR,,OBR,OBR,,OBR,CA,00000-0000,,,"REVISION APP3200503167698 PER PLAN: CHANGE DETAIL (2) PER GROUND FLOOR PLAN DETAIL.",
#200508120224,8,2005/08/12,2005/08/12,ISSUED,9,2005/12/12,400,700,"2 FAMILY DWELLING",2,"2 FAMILY DWELLING",2,1247,9,1568,,WALLER,ST,,,OBR,OBR,,OBR,OBR,,OBR,CA,00000-0000,,,"REEMOVE/REPAIR DRY ROTTED WOOD FLOOR AS NECESSARY  REMOVE/REPLACE LATHE/PLASTER WALLS",
#200508120224,8,2005/08/12,2005/08/12,ISSUED,9,2005/12/12,400,700,"2 FAMILY DWELLING",2,"2 FAMILY DWELLING",2,1247,9,1566,,WALLER,ST,,,OBR,OBR,,OBR,OBR,,OBR,CA,00000-0000,,,"REEMOVE/REPAIR DRY ROTTED WOOD FLOOR AS NECESSARY  REMOVE/REPLACE LATHE/PLASTER WALLS",
#200508120225,8,2005/08/12,2005/08/12,ISSUED,9,2006/08/12,50000,50000,"2 FAMILY DWELLING",2,"2 FAMILY DWELLING",2,1367,30,176,,08TH,AV,,,OBR,OBR,,OBR,OBR,,OBR,CA,00000-0000,,,"RENEW TO COMPLETE WORK ON 20041201748  200408101069 AND 200412020585 AND TO COMPLY W CORRECTION",
#200508150227,8,2005/08/15,2005/08/15,ISSUED,9,2005/12/15,600,600,APARTMENTS,6,APARTMENTS,6,27,4,716,,BAY,ST,,,"SAL J",BALISTRERI,4157244549,"BALISTRERI COMMERCIAL PROPERTY DEVELOPME",GREEN,ST,"SAN FRANCISCO",CA,94133-0000,,,"REMOVE EXISTING WALL HEATER  INLARGE OPENING AND BLOCK DRYWALL AND TO 1ST NEW UNIT. INSTALL NEW",
#200508150228,8,2005/08/15,2005/08/15,ISSUED,9,2006/08/15,27000,27000,OFFICE,0,OFFICE,0,24,25,655,,BEACH,ST,,,LARRY,VIGER,9257431049,"TRANS BAY AIR","PLAYA COURT",,"SAN RAMON",CA,94583-0000,,,"OFFICE - INSTALL NEW SUPPLY & RETURN DIFFUSERS",
#200508150229,8,2005/08/15,2005/08/15,ISSUED,9,2006/02/15,6800,6800,"1 FAMILY DWELLING",,"1 FAMILY DWELLING",,1472,011D,442,,41ST,AV,,,"SAM  HYUNG",SHIM,4152213154,"CALIFORNIA CONSTRUTION CO",44TH,AV,"SAN FRANCISCO",CA,94121,,,REROOFING,
#200508150230,8,2005/08/15,2005/08/15,ISSUED,9,2006/02/15,10000,10000,APARTMENTS,117,APARTMENTS,117,668,2,1330,,BUSH,ST,0,,RICHARD,MANFREDONIA,4159789600,"ON-SITE MAINTENANCE**SEE NOTE***","P.O. BOX 3211",,"SAN RAFAEL",CA,94912-0000,,,"KITCHEN & BATHROOM REMODEL. REPLACE CABINETS TUB ENCLOURSE  LIGHT  SHOWER VALUE. WORK ON ALL 4 UNITS",
#200508150231,8,2005/08/15,2005/08/15,ISSUED,9,2006/02/15,10000,10000,APARTMENTS,117,APARTMENTS,117,668,2,1330,,BUSH,ST,0,,RICHARD,MANFREDONIA,4159789600,"ON-SITE MAINTENANCE**SEE NOTE***","P.O. BOX 3211",,"SAN RAFAEL",CA,94912-0000,,,"KITCHEN & BATHROOM REMODEL REPLACE CABINETS  TUB ENCLOSURE -REPLACE LIGHTS  REPLACE SHOWER VALVE",
#200508150232,8,2005/08/15,2005/08/15,ISSUED,9,2006/08/15,50000,50000,OFFICE,0,OFFICE,0,3724,66,155,,05TH,ST,,,"GEORGE LOUIS",CARRASCO,4153828001,"G L C CONSTRUCTION","ALAMEDA DE LA LOMA",,NOVATO,CA,94949-0000,,,"NEW HVAC UNIT @ (E) VAULT ROOM.",
#200508150233,8,2005/08/15,2005/08/15,ISSUED,9,2005/12/15,1800,1800,APARTMENTS,4,APARTMENTS,4,1847,24,202,,KIRKHAM,ST,0,,TONY,NG,5667349,"NG TONY CONSTRUCTION CO",TARAVAL,ST,"SAN FRANCISCO",CA,94116,,,"REPAIR THE REAR EXTERIOR STAIRS ABOUT 25 PERCENT DRY ROT & PATH THE HOLES IN THE GROUND FLR CEILING",
#200508150233,8,2005/08/15,2005/08/15,ISSUED,9,2005/12/15,1800,1800,APARTMENTS,4,APARTMENTS,4,1847,24,208,,KIRKHAM,ST,0,,TONY,NG,5667349,"NG TONY CONSTRUCTION CO",TARAVAL,ST,"SAN FRANCISCO",CA,94116,,,"REPAIR THE REAR EXTERIOR STAIRS ABOUT 25 PERCENT DRY ROT & PATH THE HOLES IN THE GROUND FLR CEILING",
#200508150234,8,2005/08/15,2005/08/15,ISSUED,9,2005/12/15,5000,5000,"2 FAMILY DWELLING",2,"2 FAMILY DWELLING",2,2612,004A,164,,CASTRO,ST,,,"DOUGLAS M KOEFOED",*,4153787099,"KOEFOED CONST CO","1990 LAS GALLINAS AVE",,"SAN RAFAEL",CA,94903-0000,,,"REMOVE AND REPLACE  IN KIND TWO SAMLL 4'X4' ROOFS ON EACH SIDE OF FRONT BAY WINDOW AT GROUND FLOOR.",
#200508150234,8,2005/08/15,2005/08/15,ISSUED,9,2005/12/15,5000,5000,"2 FAMILY DWELLING",2,"2 FAMILY DWELLING",2,2612,004A,166,,CASTRO,ST,,,"DOUGLAS M KOEFOED",*,4153787099,"KOEFOED CONST CO","1990 LAS GALLINAS AVE",,"SAN RAFAEL",CA,94903-0000,,,"REMOVE AND REPLACE  IN KIND TWO SAMLL 4'X4' ROOFS ON EACH SIDE OF FRONT BAY WINDOW AT GROUND FLOOR.",
#200508150236,8,2005/08/15,2005/08/15,ISSUED,9,2005/12/15,1,1,"1 FAMILY DWELLING",1,"1 FAMILY DWELLING",1,7538,28,230,,BEACON,ST,,,MICHAEL,BOWER,4158500552,"BOWEN PAINTING& WATERPROOFING","W. MOLTKE",ST,"DALY CITY",CA,94014-0000,,,"RENEW APP$200409144018 FOR FINAL INSPECTION.",
#200508150237,8,2005/08/15,2005/08/15,ISSUED,9,2006/02/15,8000,8000,OFFICE,0,OFFICE,0,3749,62,303,,02ND,ST,,,"JOHNSON CONTROLS INC.","SELF-INSURED #2082",5107834000,"JOHNSON CONTROLS INC.",BREAKWATER,CT,HAYWARD,CA,94545-0000,,,"ADD ADDITIONAL LIFESAFETY  DEVICES SPEAKERS STROBES. SMOKE DETECTORS.",
#200508150238,8,2005/08/15,2005/08/15,ISSUED,9,2005/12/15,4500,4500,APARTMENTS,24,APARTMENTS,24,723,43,45,,GALILEE,LN,,,MICHAEL,LIU,,"LIU MICHAEL CONSTRUCTION CO.(CHECK ID)"," GALILEE LN #3",,"SAN FRANCISCO",CA,94115,,,"ENCLOSURE PATIO- INSTALL WINDOWS ON PATIO HANDRAIL  CLEAR PLASTIC SHEECOVER WITH SLIDING 1 BY 4 PLAN",
#200508150239,8,2005/08/15,2005/08/15,ISSUED,9,2006/08/15,44300,44300,APARTMENTS,,APARTMENTS,,47,5,1090,,CHESTNUT,ST,0,,ELDON,VERETTE,4156214612,"SAFEWAY ROOFING & SIDING CO.",TREAT,AV,"SAN FRANCISCO",CA,94110,,,REROOFING,
#200508150240,8,2005/08/15,2005/08/15,ISSUED,9,2005/12/15,4000,4000,"1 FAMILY DWELLING",,"1 FAMILY DWELLING",,3094,3,431,,FOERSTER,ST,,,NGUYEN,"HAI QUOC",8008503893,"HAI ROOFING",47TH,AV,"SAN FRANCISCO",CA,94116-0000,,,REROOFING,
#200508150241,8,2005/08/15,2005/08/15,ISSUED,9,2006/08/15,33000,33000,"2 FAMILY DWELLING",2,"2 FAMILY DWELLING",2,1073,3,1435,,LYON,ST,,,UNDECIDED,UNDECIDED,,UNDECIDED,UNDECIDED,,UNDECIDED,CA,00000-0000,,,"REMOVE EXISTING WOOD BEAM AND POST IN THE EXISTING GARAGE LEVEL AND PROVIDE WITH 5 1/2"" SLAB ON GRAD",
#200508150241,8,2005/08/15,2005/08/15,ISSUED,9,2006/08/15,33000,33000,"2 FAMILY DWELLING",2,"2 FAMILY DWELLING",2,1073,3,1437,,LYON,ST,,,UNDECIDED,UNDECIDED,,UNDECIDED,UNDECIDED,,UNDECIDED,CA,00000-0000,,,"REMOVE EXISTING WOOD BEAM AND POST IN THE EXISTING GARAGE LEVEL AND PROVIDE WITH 5 1/2"" SLAB ON GRAD",
#200508150242,8,2005/08/15,2005/08/15,ISSUED,9,2005/12/15,1500,1500,APARTMENTS,12,APARTMENTS,12,106,36,80,,ALTA,ST,0,,OBR,OBR,,OBR,OBR,,OBR,CA,00000-0000,,,"REPLACE 3 STAIRCASE SUPPORT BEAMS SAME FOR SAME.",
#200508150242,8,2005/08/15,2005/08/15,ISSUED,9,2005/12/15,1500,1500,APARTMENTS,12,APARTMENTS,12,106,36,90,,ALTA,ST,,,OBR,OBR,,OBR,OBR,,OBR,CA,00000-0000,,,"REPLACE 3 STAIRCASE SUPPORT BEAMS SAME FOR SAME.",
#200508150245,8,2005/08/15,2005/08/15,ISSUED,9,2006/08/15,53000,53000,OFFICE,0,OFFICE,0,293,6,150,,POST,ST,,,PETER,GOLDSMITH,4159782790,"GCI  INC",BERRY,ST,"SAN FRANCISCO",CA,94107-0000,,,"TENANT IMPROVEMENT FOR 1479 SQUARE FEET FILL IN DOOR ADD OFFICES T-BAR CEILING NO INCREASE IN OFFICE",
#200508150246,8,2005/08/15,2005/08/15,ISSUED,9,2005/12/15,1000,1000,"2 FAMILY DWELLING",2,"2 FAMILY DWELLING",2,730,22,1236,,PIERCE,ST,,,UNDECIDED,UNDECIDED,,UNDECIDED,UNDECIDED,,UNDECIDED,CA,00000-0000,,,"REMOVED ROTTEN WOOD BALCONYS & SEAL DOOR OPENING AT 2ND & 3RD FLOOR.",
#200508150246,8,2005/08/15,2005/08/15,ISSUED,9,2005/12/15,1000,1000,"2 FAMILY DWELLING",2,"2 FAMILY DWELLING",2,730,22,1238,,PIERCE,ST,,,UNDECIDED,UNDECIDED,,UNDECIDED,UNDECIDED,,UNDECIDED,CA,00000-0000,,,"REMOVED ROTTEN WOOD BALCONYS & SEAL DOOR OPENING AT 2ND & 3RD FLOOR.",
#200508150247,8,2005/08/15,2005/08/15,ISSUED,9,2005/12/15,1500,1500,"1 FAMILY DWELLING",1,"1 FAMILY DWELLING",1,3975,7,459,,UTAH,ST,,,OBR,OBR,,OBR,OBR,,OBR,CA,00000-0000,,,"REMOVE  & REPLACE FORNT PORCH/NEW FLOOR IN SPOTS WHERE  ROTTED SAME FOR SAME. LESS THAN 50% OF THE D",
